{
  "$schema": "../../../schemas/environment-overlay.schema.json",
  "schemaVersion": "1.0.0",
  "environment": "prod",
  "model": {
    "deploymentName": "gpt-4o",
    "parameters": {
      "temperature": 0.1
    }
  },
  "toolOverrides": {
    "knowledge-search": {
      "config": {
        "indexName": "kb-prod-v3",
        "topK": 5
      }
    }
  },
  "variables": {
    "SEARCH_CONNECTION_ID": "/subscriptions/${env:AZURE_SUBSCRIPTION_ID}/resourceGroups/rg-foundry-agents-prod/providers/Microsoft.CognitiveServices/accounts/aifagentsprod/projects/proj-agents-prod/connections/kb-search",
    "SEARCH_INDEX_NAME": "kb-prod-v3",
    "VECTOR_STORE_ID": "${env:VECTOR_STORE_ID}"
  },
  "metadata": {
    "environment": "prod",
    "change_record": "${env:CHANGE_RECORD_ID}"
  },
  "deploymentGates": {
    "requireEvaluationPass": true,
    "requireSmokeTestPass": true,
    "requireRegressionPass": true,
    "minimumEvaluationScore": 0.9
  }
}
